{
  "by_artifact": {
    "notes.md": {
      "citation_ids": [
        "sha256:6666666666666666666666666666666666666666666666666666666666666666"
      ],
      "count": 1,
      "display": "notes.md",
      "key": "notes.md"
    }
  },
  "by_batch": {
    "sha256:2222222222222222222222222222222222222222222222222222222222222222": {
      "citation_ids": [
        "sha256:6666666666666666666666666666666666666666666666666666666666666666"
      ],
      "count": 1,
      "key": "sha256:2222222222222222222222222222222222222222222222222222222222222222"
    }
  },
  "by_handle": {
    "OPENING-CLAIM": {
      "citation_ids": [
        "sha256:6666666666666666666666666666666666666666666666666666666666666666"
      ],
      "count": 1,
      "key": "OPENING-CLAIM"
    }
  },
  "by_status": {
    "resolved": {
      "citation_ids": [
        "sha256:6666666666666666666666666666666666666666666666666666666666666666"
      ],
      "count": 1,
      "key": "resolved"
    }
  },
  "by_tag": {
    "overview": {
      "citation_ids": [
        "sha256:6666666666666666666666666666666666666666666666666666666666666666"
      ],
      "count": 1,
      "key": "overview"
    }
  }
}
